data/processed/sinan/feature_ranking_brasilia_2022_2024.csv

feature,anova_f,anova_pvalue,mutual_information,random_forest_importance,score_anova_norm,score_mi_norm,score_rf_norm,composite_score,selected
NOTIFICACOES,351.48690732657104,1.3759288061144512e-41,0.32379838102503233,0.1472120353035162,1.0,0.9229509818129342,1.0,0.9743169939376447,True
dor_retro_flag,225.7817664061615,5.413616663080306e-32,0.34897103905383586,0.14422703075093324,0.6423617969173693,1.0,0.9796991065803522,0.8740203011659071,True
febre_flag,134.40230771690005,9.75730234288083e-23,0.31060764277188757,0.10038260048565024,0.3823820923086066,0.882576483799874,0.6815149362780013,0.6488245041288273,True
cefaleia_flag,114.9587292205727,2.1963108878338524e-20,0.2832152499656493,0.07639944337648975,0.32706401681855657,0.7987332532161143,0.518406469351734,0.5480679131288017,True
criterio_clinico_epi,139.76941367865368,2.3353137941549942e-23,0.269473335954423,0.050010365316260186,0.3976518109363512,0.7566717044768216,0.33893543280677463,0.4977529827399825,True
nausea_flag,124.85848712580403,1.3277798358225274e-21,0.2355457689140612,0.06420057915590749,0.35522938541252436,0.6528254707201564,0.4354424945837549,0.48116578357214523,True
artralgia_flag,78.34392713700883,1.9284529605442307e-15,0.24257805525700582,0.05205806290207841,0.2228928434877619,0.674350045427929,0.3528617400244285,0.4167015429800398,True
criterio_lab,100.68236167409596,1.5206179170850169e-18,0.220337136277172,0.041222710890080234,0.2864469473933541,0.606274557769317,0.2791709558111848,0.39063082032461866,True
caso_dengue_alarme,87.35776228975206,9.943841239084831e-17,0.23195730721280472,0.03889403514098235,0.24853771197369934,0.6418418292402883,0.26333372763997553,0.38457108961798775,True
laco_flag,117.55236849497544,1.0425091874651463e-20,0.20062296804983237,0.020083232066483915,0.33444306657539374,0.5459330036691059,0.13540222816439396,0.3385927661362979,True
dor_costas_flag,120.45688941284284,4.5644963017745315e-21,0.17971204547527586,0.014272338134084503,0.34270659211043697,0.4819283978816769,0.0958825770829774,0.30683918902503043,True
artrite_flag,107.9748363896536,1.6949866298669442e-19,0.18708546869860498,0.012670951655608137,0.3071944485233903,0.5044971317589322,0.08499161338408358,0.298894397888802,True
alrm_hepat_flag,0.30749055355097077,0.5800285968398593,0.25516834047392867,0.016502584948580937,0.0008747879784007742,0.7128866637520266,0.11105039411073478,0.2749372819470541,True
obito_agravo,4.635000747482679,0.032883145172079464,0.23245517558265893,0.02288892676308872,0.013186798117742824,0.6433657155553437,0.1544836426146864,0.2703453854292576,True
grav_melen_flag,0.16758198155516563,0.682838583667496,0.2460568907583962,0.01642194109221176,0.00047674021425946956,0.6849981406552877,0.11050193855421532,0.2653256064745875,True
grav_ench_flag,1.3421965964391183,0.2484403745937939,0.2359887008819297,0.01288549508792724,0.003818584924076646,0.6541812065033574,0.08645071445970061,0.2481501686290449,True
grav_orgao_flag,3.524995326033298,0.0623410795511646,0.21335758937672056,0.01166842364179453,0.010028770200726414,0.5849114090920885,0.07817346151860981,0.22437121360380827,True
mialgia_flag,41.54281179152435,1.4045734874818346e-09,0.17061319292774235,0.014777725929564833,0.11819159843741885,0.45407843247023083,0.09931969873251023,0.22386324321338666,False
exantema_flag,57.55656697757396,2.9123072890120464e-12,0.12829321845256247,0.027053196985842916,0.16375163351164135,0.32454453583987664,0.18280467344513981,0.22370028093221928,False
grav_pulso_flag,0.279106448406759,0.5980479707781587,0.21817852165941898,0.00679105644160301,0.0007940336012483583,0.5996674232842814,0.04500268741915485,0.2151547147682282,False
raca_parda,10.704251007251562,0.0013193430890463236,0.208534755375966,0.0061188947212673294,0.03045415680386729,0.5701495740799836,0.04043134315319915,0.21367835801235002,False
grav_insuf_flag,0.023990025257922362,0.8771131091228161,0.22660201938677038,0.0019753246303278195,6.821301440707367e-05,0.6254502480003193,0.01225109306942128,0.21258985136138256,False
obito_outras_causas,4.582313999267217,0.033877772664159624,0.21585929295845463,0.000801379808304827,0.013036901352820733,0.5925686777264584,0.0042671425284367,0.20329090720257195,False
alrm_liq_flag,0.1152365219102883,0.7347219170564101,0.20654576567590532,0.004410742194881891,0.00032781443453514333,0.5640616312255378,0.02881426794550928,0.1977345712018607,False
grav_conv_flag,0.10259381215769384,0.749173068447621,0.21111101979186486,0.0011585879251095363,0.00029184521350801015,0.5780350601342632,0.006696500266471158,0.19500780187141412,False
raca_preta,46.62245835507639,1.8684357865339266e-10,0.13934987668483512,0.008597204331134554,0.13264347889339673,0.35838699539467467,0.05728622506862804,0.1827722331188998,False
grav_hemat_flag,0.3333090421160829,0.5645601412159889,0.19809129600019726,0.0009195335738531646,0.0009482430319421603,0.5381840068975761,0.0050707014374009405,0.18140098378897307,False
grav_sang_flag,0.017258336065396698,0.8956533071027015,0.18755881062360258,0.00367245833676737,4.906097966213063e-05,0.505945946999107,0.023793229735011377,0.17659607923792686,False
vomito_flag,10.811701157078494,0.0012497028563430187,0.1699485938502494,0.006921756874976076,0.03075985852953811,0.45204421318555027,0.04589157570092059,0.17623188247200297,False
alrm_vom_flag,0.05342454315726693,0.8175147894352747,0.18991066382899646,0.0007297919229818023,0.00015195587498578506,0.5131445503483583,0.0037802762592301304,0.17235892749419138,False
grav_metro_flag,0.010103168898304305,0.9200665933373023,0.17697697499926024,0.006079449037000605,2.8704126237854434e-05,0.47355683479094957,0.04016307467385263,0.17124953786368002,False
alrm_hemat_flag,2.0790570231837187,0.15136293312726568,0.17799994657137197,0.0033422033016827944,0.005914994323199738,0.4766879683873421,0.021547178799259017,0.16805004716993363,False
raca_branca,18.721768741578856,2.709295103554281e-05,0.1280563763131859,0.018510878854704562,0.05326444614202109,0.3238196042778855,0.1247087185204128,0.16726425631343977,False
grav_ast_flag,0.021824260636089138,0.8827488107606062,0.17456657198082026,0.0006888463022174032,6.205129212601929e-05,0.46617902090282404,0.0035018067733393605,0.15658095965609645,False
grav_consc_flag,1.3994416613483849,0.23864014411645995,0.17315540720185596,0.0006776994798193145,0.003981450356624557,0.46185969711131364,0.0034259976918170126,0.1564223817199184,False
conjuntvit_flag,58.243891065110795,2.2593115342941497e-12,0.10759038129682064,0.004612838433033349,0.1657071092368364,0.2611768424198413,0.030188716164582973,0.15235755594042022,False
grav_taqui_flag,0.9027181593564719,0.34354261171171807,0.16622668143636932,0.001961870121132343,0.0025682440280641594,0.4406521028673002,0.012159589504726651,0.1517933121333637,False
alrm_letar_flag,0.0023996168732350032,0.9609940187631814,0.15351984848008926,0.001837216612326017,6.787087018720713e-06,0.40175875269235395,0.011311826108696781,0.13769245529602317,False
grav_hipot_flag,0.11888092169474722,0.7307218331390731,0.15662764001837615,0.000275040026808663,0.00033818295710061146,0.4112711485021681,0.0006875272821455918,0.1374322862471381,False
raca_indigena,1.483684409785097,0.22506184854241765,0.14779049834294167,0.0014339880750629033,0.0042211257187700375,0.38422223340972445,0.008569485380386805,0.13233761483629378,False
gestante,9.202457225789097,0.002837440292269911,0.13053162253293094,0.003831841057547559,0.026181468945039216,0.3313958916442962,0.024877185075947886,0.12748484855509443,False
caso_inconclusivo,0.3752659392021899,0.5410512996438852,0.13908427617678965,0.00184728476057859,0.0010676127663136357,0.3575740395935243,0.011380299171637954,0.12334065051049196,False
caso_confirmado_provavel,0.3777372731448884,0.5397237001447608,0.1392369013294148,0.0017550994929918728,0.0010746438505160186,0.3580411979741357,0.010753350951233975,0.12328973092529523,False
caso_dengue_grave,3.0878145476167083,0.08086789336946358,0.13745395055432397,0.001075499258617421,0.008784966272976397,0.35258390353429436,0.006131417656671617,0.12250009582131414,False
hipertensa_flag,29.473593929967016,2.1625739430995847e-07,0.09203450523905077,0.0012225939810804306,0.08385399412771839,0.21356307926779727,0.007131802825508385,0.10151629207367469,False
renal_flag,0.2408729113191922,0.6242749812252208,0.11588066778303796,0.0007903934866375246,0.0006852570356968499,0.2865519312770312,0.004192425005795443,0.09714320443950782,False
hepatopat_flag,2.1221551558750407,0.14721803906787528,0.11430696213450586,0.0006925324970111909,0.006037610937119293,0.28173509886322345,0.0035268764328036956,0.09709986207771548,False
grav_extre_flag,0.16412832010423417,0.685945986640123,0.11474116113036925,0.0011682584246251353,0.0004669143529914016,0.2830641045761205,0.006762268936676721,0.0967644292885962,False
alrm_sang_flag,1.4044742591432742e-05,0.9970146798548432,0.11499621999383236,0.00031107832120011377,0.0,0.28384479428267656,0.0009326222428328921,0.09492580550850316,False
sexo_masc,8.556126918966552,0.003964455807516945,0.1018121023336962,0.0017483579973240617,0.024342622833914654,0.24349056072442848,0.010707502315953731,0.0928468952914323,False
alrm_plaq_flag,2.4013061670795897,0.12328661150291456,0.10644181219128557,0.0005715444665802103,0.006831811280119625,0.2576612771664536,0.0027040418047268,0.08906571008376667,False
alrm_abdom_flag,3.6370088583802236,0.05837025940947677,0.10387468687960344,0.00017394732981221785,0.010347455006583774,0.24980376428076828,0.0,0.08671707309578403,False
alrm_hipot_flag,2.2502176745056354e-05,0.9962212716735475,0.10402176494409443,0.001325081093835472,2.4061876318222457e-08,0.2502539440135926,0.007828813471983671,0.08602759384915086,False
grav_mioc_flag,2.876620965099775,0.09189501717722866,0.09277315894645399,0.0019100185933277904,0.008184108640576447,0.21582396657141587,0.011806949392772628,0.07860500820158832,False
sexo_fem,8.210372505474501,0.004747565224954027,0.08757781207485871,0.00197560354061842,0.02335893206165357,0.1999219360770745,0.012252989926857638,0.0785112860218619,False
leucopenia_flag,0.559680218704239,0.4555300682395612,0.09315514944117265,0.0012596442171181144,0.0015922817739690146,0.2169931713705748,0.007383779959788788,0.0753230777014442,False
hematolog_flag,7.652572388243763,0.006363417940067865,0.08276185272571768,0.001476255114029489,0.021771959324142463,0.18518114314787532,0.008856941777222875,0.07193668141641356,False
auto_imune_flag,2.0820258165538026,0.15107318296896535,0.0876748818958557,0.0010600044209439494,0.005923440707479858,0.20021904949254518,0.006026037901759117,0.07072284270059472,False
acido_pept_flag,4.720160464073074,0.031340103306961554,0.08146228431085278,0.0006404570860342106,0.013429082305910582,0.18120339593033125,0.003172713700584997,0.06593506397894228,False
petequia_n_flag,5.76033045084808,0.017585905314205293,0.07436055087364557,0.0016989887685132162,0.01638842447956307,0.15946625604875955,0.010371744217550855,0.06207547491529116,False
hospitalizado,5.458163251532943,0.020765956527979367,0.06764534439310577,0.0008410529951815929,0.0155287417855832,0.13891220626756504,0.0045369582436945105,0.052992635432280916,False
criterio_clinico,0.23853552480655907,0.6259605671343739,0.07005154236556765,0.0013982829131281174,0.0006786070394742056,0.14627714925967022,0.0083266560398613,0.05176080411300191,False
diabetes_flag,12.150565476570648,0.0006394875960993888,0.04583497244922086,0.0014825140835329704,0.03456900289617778,0.0721545463236608,0.00889950877186851,0.03854101933056903,False
atraso_notificacao_dias,1.132375944159445,0.2889347982142542,0.04648320274203854,0.0012865246966599288,0.0032216333554972868,0.07413866367684487,0.007566592997636653,0.028308963343326266,False
raca_amarela,1.044115421910955,0.30846875410046076,0.0379967666487564,0.0009889501551358195,0.0029705272006577627,0.04816319584398899,0.005542800756966829,0.01889217460053786,False
idade_anos,4.6632302342379255,0.03236295043425916,0.022261385626619612,0.0021197506158537123,0.013267112596873661,0.0,0.013233328267907551,0.008833480288260405,False

data/processed/sinan/relatorio_sinan_brasilia_2022_2024.md

## 6. Atributos Selecionados por Intensidade

- NOTIFICACOES: score composto 0.9743
- dor_retro_flag: score composto 0.8740
- febre_flag: score composto 0.6488
- cefaleia_flag: score composto 0.5481
- criterio_clinico_epi: score composto 0.4978
- nausea_flag: score composto 0.4812
- artralgia_flag: score composto 0.4167
- criterio_lab: score composto 0.3906
- caso_dengue_alarme: score composto 0.3846
- laco_flag: score composto 0.3386
- dor_costas_flag: score composto 0.3068
- artrite_flag: score composto 0.2989
- alrm_hepat_flag: score composto 0.2749
- obito_agravo: score composto 0.2703
- grav_melen_flag: score composto 0.2653